{
  "schema": "cap.gate_result.v1",
  "digestId": "cap-digest-basic-table",
  "fingerprint": "structure_v1:orders-1000x4",
  "overallDecision": "stale_source",
  "remainingBudget": null,
  "policyRef": "fixture://basic-table/policy.json",
  "requests": [
    {
      "requestIndex": 0,
      "request": {
        "fieldId": "f1:table@sample#k10",
        "level": 1,
        "budget": 300,
        "reason": "Need sample rows before commenting on values."
      },
      "decision": "stale_source",
      "approvedLevel": null,
      "approvedBudget": null,
      "requiresUserConfirmation": false,
      "problems": [
        {
          "code": "gate_stale_source",
          "message": "Source fingerprint changed.",
          "fieldId": "f1:table@sample#k10",
          "retryable": true
        }
      ]
    }
  ],
  "patch": null
}
